question,answer,source_page
How can I convert a Series of datetime objects to a frequency that represents the number of days between each date?,"You can use the `td` alias for `timedelta64[ns]`, which represents a timedelta in nanoseconds. To get the number of days, multiply by -1 and then use the `dt.days` attribute on the resulting Series.",https://pandas.pydata.org/docs/user_guide/timedeltas.html
What happens when I divide a Series of datetime objects by another Series or a scalar?,"When you divide a Series of datetime objects by another Series, it performs element-wise division. If you divide by a scalar, it rounds down to the nearest integer using floor-division. The result is a new Series with timedelta values that represent the difference between each original date and the divisor.",https://pandas.pydata.org/docs/user_guide/timedeltas.html
How can I find the remainder when dividing one datetime object by another?,"You can use the modulo operator (`%`) on two datetime-like objects or numbers. This returns the remainder as a timedelta value. For example, `td % pd.Timedelta(hours=2)` gives you the remaining hours in the original date.",https://pandas.pydata.org/docs/user_guide/timedeltas.html
What is the result of dividing a timedelta by another timedelta?,"When you divide one timedelta by another, the result is a float representing the ratio of the two values. If the divisor is zero, it returns NaN (Not a Number). For example, `td // pd.Timedelta(days=3, hours=4)` gives you a float between 0 and 1, where 1 represents the original timedelta value.",https://pandas.pydata.org/docs/user_guide/timedeltas.html
How do I access the number of seconds in a pandas Timedelta object?,"You can access the number of seconds in a pandas Timedelta object using the .seconds attribute, which returns an integer value representing the number of seconds >= 0 and < 1 day. For example: pd.Timedelta('31 days 5 min 3 sec').seconds",https://pandas.pydata.org/docs/user_guide/timedeltas.html
What does the .components property do for a pandas Timedelta object?,"The .components property returns a DataFrame with the displayed values of the Timedelta, which are the components used to create it. For example: pd.Timedelta('31 days 5 min 3 sec').dt.components",https://pandas.pydata.org/docs/user_guide/timedeltas.html
How can I get both the signed and unsigned seconds for a pandas Timedelta object?,"You can use the .seconds attribute to get the number of seconds >= 0 and < 1 day, or (-tds).seconds to get the negative value for negative Timedeltas. For example: pd.Timedelta('31 days 5 min 3 sec').seconds; (-pd.Timedelta('31 days 5 min 3 sec')).seconds",https://pandas.pydata.org/docs/user_guide/timedeltas.html
How do I generate a range of time deltas for the next 30 days?,"You can use `timedelta_range(start='2022-01-01', periods=30, freq='D')` to get a TimedeltaIndex representing the next 30 days. This will return a series of datetime objects spaced one day apart.",https://pandas.pydata.org/docs/user_guide/timedeltas.html
What is the purpose of the `periods` parameter in `timedelta_range()`?,"The `periods` parameter specifies the number of periods (in this case, time deltas) to generate. For example, if you set it to 30, you will get a range of 30 time deltas.",https://pandas.pydata.org/docs/user_guide/timedeltas.html
How does pandas handle date arithmetic with TimedeltaIndex and DatetimeIndex?,"When combining a TimedeltaIndex with a DatetimeIndex, NaT (Not a Time) values are preserved. This allows for precise date calculations while handling missing or invalid dates. The result is a new DatetimeIndex with the combined dates. For instance, adding a TimedeltaIndex to a DatetimeIndex results in a new index where dates are shifted by the specified time intervals, preserving NaT values.",https://pandas.pydata.org/docs/user_guide/timedeltas.html
What happens when you add or subtract a TimedeltaIndex from a DatetimeIndex?,"When adding or subtracting a TimedeltaIndex from a DatetimeIndex, the result is a new DatetimeIndex where dates are shifted by the specified time intervals. NaT values in the original index remain unchanged. For example, adding a TimedeltaIndex to a DatetimeIndex shifts all dates forward by the specified interval, leaving any missing or invalid dates as-is.",https://pandas.pydata.org/docs/user_guide/timedeltas.html
How does resampling with a TimedeltaIndex affect the frequency of the output?,"Resampling with a TimedeltaIndex will change the frequency of the output to match the specified interval. The result is a new Series with the same values, but at a different index. For example, if you resample a daily Series by 'D', the output will have a frequency of 'D' and the index will be a DatetimeIndex representing the start of each day.",https://pandas.pydata.org/docs/user_guide/timedeltas.html
What does the Freq attribute in the output of resampled data represent?,"The Freq attribute represents the frequency of the output. In this case, the Freq is set to 'D', indicating that the output has a daily frequency. This can be useful for understanding how often values are being measured or observed.",https://pandas.pydata.org/docs/user_guide/timedeltas.html
How can I convert a column to a frequency-based date range in pandas?,"You can use the pd.Grouper function with the freq parameter, e.g., df.groupby(pd.Grouper(freq='D')). This will group your data by day and return a grouped Series. The result looks like a hierarchical index with the dates as levels.",https://pandas.pydata.org/docs/user_guide/timeseries.html
What is the purpose of using the resample method in pandas for time series data?,"The resample method allows you to apply aggregation functions (like mean, sum, or count) over a specified frequency interval. For example, df.resample('M').mean() will calculate the mean value for each month. The result is a new Series with the aggregated values.",https://pandas.pydata.org/docs/user_guide/timeseries.html
How can I parse time series information from various sources and formats into a pandas DatetimeIndex?,"You can use the `pd.to_datetime()` function to parse time series information from various sources and formats, such as strings or datetime objects. This will return a DatetimeIndex with the specified frequency.",https://pandas.pydata.org/docs/user_guide/timeseries.html
How do I generate sequences of fixed-frequency dates and time spans using pandas?,"You can use the `pd.date_range()` function to generate sequences of fixed-frequency dates and time spans. For example, `pd.date_range('2018-01-01', periods=3, freq='h')` will return a DatetimeIndex with hourly frequencies.",https://pandas.pydata.org/docs/user_guide/timeseries.html
How do I manipulate and convert date times with timezone information using pandas?,"You can use the `tz_localize()` and `tz_convert()` methods to manipulate and convert date times with timezone information. For example, `dti.tz_localize('UTC')` will localize the datetime index to UTC time zone.",https://pandas.pydata.org/docs/user_guide/timeseries.html
How do I resample or convert a time series to a particular frequency using pandas?,"You can use the `resample()` method to resample a time series to a particular frequency. For example, `ts.resample('2h').mean()` will resample the time series to 2-hour frequencies and calculate the mean value.",https://pandas.pydata.org/docs/user_guide/timeseries.html
How do I perform date and time arithmetic with absolute or relative time increments using pandas?,"You can use the `Timestamp` class and various offset objects (e.g., `Timedelta`, `offsets.BDay`) to perform date and time arithmetic. For example, `friday + pd.Timedelta('1 day')` will add 1 day to a given datetime object.",https://pandas.pydata.org/docs/user_guide/timeseries.html
How do I create a pandas Series with a specific frequency?,"You can use the `pd.date_range` function to create a pandas Series with a specific frequency. For example, `pd.Series(pd.date_range('2000', freq='D', periods=3'))` will create a series with dates from 2000-01-01 to 2000-01-03.",https://pandas.pydata.org/docs/user_guide/timeseries.html
What is the difference between `pd.period_range` and `pd.date_range`?,"The main difference is that `pd.period_range` creates periods (e.g., '1/1/2011') whereas `pd.date_range` creates dates (e.g., '2000-01-01').",https://pandas.pydata.org/docs/user_guide/timeseries.html
How do I add a timedelta to a pandas Series?,"You can use the `pd.DateOffset` function to create a timedelta. For example, `pd.Series([pd.DateOffset(1), pd.DateOffset(2)])` will create a series with two consecutive date offsets.",https://pandas.pydata.org/docs/user_guide/timeseries.html
How do I create a pandas object that associates values with specific points in time?,"You can use the pd.Timestamp function, which returns a Timestamp object. This object represents a point in time and is used to associate values with specific dates and times.",https://pandas.pydata.org/docs/user_guide/timeseries.html
"What happens when you pass different types of data (integers, strings) to pd.Timestamp? How do you specify the desired format?","When passing integers or strings to pd.Timestamp, it infers the format from the input. You can also explicitly specify the format using a datetime string.",https://pandas.pydata.org/docs/user_guide/timeseries.html
How can I represent time spans in pandas data instead of timestamps? What is Period and how does it relate to Timestamp?,"You can use the pd.Period function to create Period objects, which represent time spans. These objects can be used as an index for pandas objects and are automatically coerced into DatetimeIndex or PeriodIndex when combined with Timestamp objects.",https://pandas.pydata.org/docs/user_guide/timeseries.html
How do I specify a timestamp with nanosecond precision when using pandas?,"When converting to timestamps, you can use the 'ns' unit to represent nanoseconds. For example: pd.to_datetime('2022-01-01 12:00:00.123456789 ns'). This will result in a datetime object with nanosecond precision.",https://pandas.pydata.org/docs/user_guide/timeseries.html
What is the default unit of time used when converting a string to a timestamp in pandas?,"The default unit of time used when converting a string to a timestamp in pandas depends on the input string. If you use 's' (seconds), 'ms' (milliseconds), or 'us' (microseconds), it will be converted accordingly. However, if you don't specify any unit, pandas will assume seconds by default.",https://pandas.pydata.org/docs/user_guide/timeseries.html
How can I specify a custom date format when converting a string to a datetime object?,"You can use the format argument to specify a custom date format. For example, `pd.to_datetime('2010/11/12', format='%Y/%m/%d')` will convert the string to a datetime object in the specified format.",https://pandas.pydata.org/docs/user_guide/timeseries.html
How do I assemble a Series of Timestamps from multiple columns of a DataFrame?,"You can pass a DataFrame with integer or string columns to `pd.to_datetime()`, and it will assemble them into a Series of Timestamps. For example, `pd.to_datetime(df[['year', 'month', 'day']])` will convert the specified columns to datetime objects.",https://pandas.pydata.org/docs/user_guide/timeseries.html
What are the standard designations for datetime components in column names?,"The standard designations include year, month, day, hour, minute, second, millisecond, microsecond, and nanosecond. When using `pd.to_datetime()`, it will look for these designations in the column names to determine how to assemble the datetime objects.",https://pandas.pydata.org/docs/user_guide/timeseries.html
How can I specify which columns to use when assembling a Series of Timestamps from multiple columns?,"You can pass only the columns you need to `pd.to_datetime()` by specifying them in a list. For example, `pd.to_datetime(df[['year', 'month', 'day']])` will convert only these three columns to datetime objects.",https://pandas.pydata.org/docs/user_guide/timeseries.html
What happens when you try to parse a string with non-standard date format using pandas' to_datetime function?,The function raises a ValueError with the original string as its argument. The error message will include the problematic string and an explanation of what went wrong.,https://pandas.pydata.org/docs/user_guide/timeseries.html
How can you tell if the errors parameter in pandas' to_datetime function is set to 'raise' or 'coerce'?,"If the errors parameter is set to 'raise', the function will raise a ValueError. If it's set to 'coerce', the function will replace unparseable values with NaT (Not a Time).",https://pandas.pydata.org/docs/user_guide/timeseries.html
What does the dayfirst parameter in pandas' to_datetime function do?,"The dayfirst parameter determines whether the day comes before or after the month when parsing dates. If set to True, the day is considered first, and if set to False, the month is considered first.",https://pandas.pydata.org/docs/user_guide/timeseries.html
How can I convert a list of strings representing dates in different formats into a pandas datetime index?,"You can use the `pd.to_datetime` function with the correct format parameter. If your strings have a consistent format, you can pass `format`. For ISO8601 dates, try passing `format='ISO8601'`. For mixed formats, use `format='mixed'`, and pandas will infer the format for each element individually. Additionally, consider using `dayfirst=True` to handle dates with day-first formats. If there are any unparsable data points, pass `errors='coerce'` to convert them to NaT (not a time).",https://pandas.pydata.org/docs/user_guide/timeseries.html
What happens when I use `pd.to_datetime` on a list that contains both parsable and unparsable date strings?,"When you use `pd.to_datetime` with `errors='coerce'`, it will convert any unparsable data points to NaT (not a time). The resulting datetime index will contain NaT for the unparsable dates, while the parsable dates will be converted to their respective datetime values.",https://pandas.pydata.org/docs/user_guide/timeseries.html
How can I convert a pandas DatetimeIndex to a Unix epoch integer?,"You can convert a pandas DatetimeIndex to a Unix epoch integer by subtracting the epoch (midnight at January 1, 1970 UTC) and then floor dividing by the unit (1 second). Alternatively, you can directly convert it to an integer dtype or use the as_unit method with the 's' unit.",https://pandas.pydata.org/docs/user_guide/timeseries.html
What is the purpose of using the as_unit method in pandas?,"The as_unit method allows you to specify a unit for your datetime values, which can be useful when working with dates that have different time resolutions (e.g., seconds vs. nanoseconds). The returned integer dtype will contain the converted value in the specified unit.",https://pandas.pydata.org/docs/user_guide/timeseries.html
How do I convert a pandas DatetimeIndex from days to seconds?,You can convert a pandas DatetimeIndex from days to seconds by using the as_unit method with the 's' unit. This will return an integer dtype containing the converted values in seconds.,https://pandas.pydata.org/docs/user_guide/timeseries.html
What happens when you convert a pandas DatetimeIndex to nanoseconds?,"When you convert a pandas DatetimeIndex to nanoseconds, the resulting integer dtype will contain the converted values in nanoseconds. Note that this can result in larger integers than using the 's' unit.",https://pandas.pydata.org/docs/user_guide/timeseries.html
"How can I create a datetime index that starts from January 1, 1960, instead of the default Unix epoch?","You can use the origin parameter when creating a DatetimeIndex. For example: pd.to_datetime([1, 2, 3], unit='D', origin=pd.Timestamp('1960-01-01')). This will create a datetime index that starts from January 1, 1960.

The result is a DatetimeIndex with the specified start date and no frequency set:
DatetimeIndex(['1960-01-02', '1960-01-03', '1960-01-04'], dtype='datetime64[s]', freq=None)",https://pandas.pydata.org/docs/user_guide/timeseries.html
What happens when I create a datetime index without specifying the origin parameter?,"When you don't specify the origin parameter, pandas defaults to using the Unix epoch (January 1, 1970). This means that any dates in your dataset will be adjusted to this reference point.

For example: pd.to_datetime([1, 2, 3], unit='D'). The result is a DatetimeIndex with the default Unix epoch:
DatetimeIndex(['1970-01-02', '1970-01-03', '1970-01-04'], dtype='datetime64[s]', freq=None)",https://pandas.pydata.org/docs/user_guide/timeseries.html
How can I generate a DatetimeIndex with timestamps for a large number of dates?,"You can use the date_range() function to create a DatetimeIndex with timestamps on a regular frequency. For example, to get a DatetimeIndex with timestamps from January 1st, 2011 to January 1st, 2012, you can use pd.date_range('2011-01-01', '2012-01-01').",https://pandas.pydata.org/docs/user_guide/timeseries.html
What is the difference between using pd.DatetimeIndex and pd.Index when creating a DatetimeIndex from a list of datetime objects?,"Using pd.DatetimeIndex creates a DatetimeIndex with frequency information, while using pd.Index creates a DatetimeIndex without frequency information. For example, pd.DatetimeIndex([datetime.datetime(2012, 5, 1), datetime.datetime(2012, 5, 2)]) will have a freq attribute like 'MS', while pd.Index([datetime.datetime(2012, 5, 1), datetime.datetime(2012, 5, 2)]) will not.",https://pandas.pydata.org/docs/user_guide/timeseries.html
How can I create a DatetimeIndex with timestamps on a regular frequency using the date_range() function?,"You can use the date_range() function to create a DatetimeIndex with timestamps on a regular frequency. For example, to get a DatetimeIndex with timestamps from January 1st, 2011 to January 1st, 2012, you can use pd.date_range('2011-01-01', '2012-01-01').",https://pandas.pydata.org/docs/user_guide/timeseries.html
What is the default frequency for the date_range() function?,"The default frequency for the date_range() function is a calendar day. If you want to create a DatetimeIndex with timestamps on a regular frequency, it's recommended to use the date_range() function instead of creating a DatetimeIndex from a list of datetime objects.",https://pandas.pydata.org/docs/user_guide/timeseries.html
How can I create a date range of all business days between two dates in pandas?,"You can use the `pd.bdate_range` function with the `freq='BQS'` parameter to get a list of business day dates. For example, `pd.bdate_range('2011-01-01', '2020-12-31', freq='BQS')`. This will return a `DatetimeIndex` containing all the business days between these two dates.",https://pandas.pydata.org/docs/user_guide/timeseries.html
What is the difference between `pd.date_range` and `pd.bdate_range` in pandas?,"The main difference is that `pd.date_range` can create date ranges for any frequency, while `pd.bdate_range` is limited to creating business day ranges. For example, you can use `pd.date_range('2011-01-01', '2020-12-31', freq='ME')` to get a list of all month-end dates.",https://pandas.pydata.org/docs/user_guide/timeseries.html
How can I create a date range of all weekdays between two dates in pandas?,"You can use the `pd.date_range` function with the `freq='W'` parameter to get a list of weekday dates. For example, `pd.date_range('2011-01-01', '2020-12-31', freq='W')`. This will return a `DatetimeIndex` containing all the weekdays between these two dates.",https://pandas.pydata.org/docs/user_guide/timeseries.html
Can I customize the frequency alias when creating a date range in pandas?,"Yes, you can use any valid frequency alias. For example, `pd.date_range('2011-01-01', '2020-12-31', freq='M')` will create a list of all month dates.",https://pandas.pydata.org/docs/user_guide/timeseries.html
"How can I generate a range of evenly spaced dates from start to end, inclusive?","You can use the date_range function with the periods parameter. For example, pd.date_range('2022-01-01', '2022-01-31', periods=10) will return a DatetimeIndex with 10 dates between January 1st and January 31st.",https://pandas.pydata.org/docs/user_guide/timeseries.html
What is the difference between date_range and bdate_range in pandas?,"The main difference is that date_range generates dates from start to end, inclusive, while bdate_range generates business dates (i.e., weekdays excluding weekends and holidays). For example, pd.date_range('2022-01-03', '2022-01-07', periods=5) will return a DatetimeIndex with 5 business dates between January 3rd and January 7th.",https://pandas.pydata.org/docs/user_guide/timeseries.html
How can I specify the frequency of the date range?,"You can use the freq parameter in the date_range function. For example, pd.date_range('2022-01-01', '2022-01-31', periods=10, freq='W') will return a DatetimeIndex with 10 weekly dates between January 1st and January 31st.",https://pandas.pydata.org/docs/user_guide/timeseries.html
What is the return value of date_range when no frequency is specified?,"When no frequency is specified, date_range returns a DatetimeIndex with the default frequency. For example, pd.date_range('2022-01-01', '2022-01-31', periods=10) will return a DatetimeIndex with the default frequency.",https://pandas.pydata.org/docs/user_guide/timeseries.html
"How can I generate a range of dates from start to end, inclusive, with a specific number of elements?","You can use the date_range function with the periods parameter. For example, pd.date_range('2022-01-01', '2022-01-31', periods=5) will return a DatetimeIndex with 5 dates between January 1st and January 31st.",https://pandas.pydata.org/docs/user_guide/timeseries.html
How does pandas handle timestamp resolution?,"Pandas uses a 64-bit integer for nanosecond resolution, which limits the representable time span to approximately 584 years. With second-resolution, the range grows to +/- 2.9e11 years. You can convert between resolutions using the as_unit method.",https://pandas.pydata.org/docs/user_guide/timeseries.html
What happens when you try to represent a timestamp that is out of bounds?,"When trying to represent a timestamp that is outside the valid range, pandas will raise an error or return a NaT (Not a Time) value. You can use the represents_in method to check if a timestamp falls within the valid range.",https://pandas.pydata.org/docs/user_guide/timeseries.html
How can I create a time series with random values and specify the frequency?,"You can use `pd.date_range` to create a datetime index and then pass it to `pd.Series` along with your random values. The frequency parameter specifies how often the index values occur, e.g., `pd.date_range(start, end, freq='BME')`. This will result in a time series where each value is assigned a unique date within the specified range and frequency.",https://pandas.pydata.org/docs/user_guide/timeseries.html
How can I access every other value from a time series by its datetime index?,"You can use slicing to achieve this. For example, `ts[::2].index` will return every other value from the original time series. The `::2` slice means 'start at the beginning, go to the end, and step by 2'. This results in a datetime index with values spaced evenly apart by the specified frequency.",https://pandas.pydata.org/docs/user_guide/timeseries.html
How can I access a specific date range from a pandas DataFrame?,"You can use the loc function to access a specific row or column, and then specify the date range using string notation (e.g., '2013-01-01': '2013-02-28').<br>For example: dft.loc['2013-01':'2013-02']",https://pandas.pydata.org/docs/user_guide/timeseries.html
What does it mean to use a date range in pandas DataFrame indexing?,"When using a date range, pandas will return all rows within that specific time period. The start and end dates are inclusive.<br>For example: dft.loc['2013-01':'2013-02'] would return the first row on January 1st, 2013, to the last row on February 28th, 2013.",https://pandas.pydata.org/docs/user_guide/timeseries.html
How can I get a subset of rows from a pandas DataFrame based on a date range?,"You can use the loc function with a string notation to specify the date range (e.g., '2013-01':'2013-02').<br>For example: dft.loc['2013-01':'2013-02']",https://pandas.pydata.org/docs/user_guide/timeseries.html
What is the effect of using a date range in pandas DataFrame indexing when no specific dates are provided?,"When no specific dates are provided, pandas will return all rows within a month. The start date is always the first day of the month, and the end date is always the last day of the month.<br>For example: dft.loc['2013':'2014'] would return all rows from January 1st, 2013, to December 31st, 2013.",https://pandas.pydata.org/docs/user_guide/timeseries.html
How do I get a subset of rows from a pandas DataFrame that corresponds to a specific date range?,"You can use the stop time parameter to specify a date range. For example, to get data for February 28th, 2013, you would use `dft['2013-1':'2013-2-28']`. This will return all rows where the index is within the specified date range.",https://pandas.pydata.org/docs/user_guide/timeseries.html
What happens when I specify a stop time with an exact end-point in pandas?,"When you specify a stop time with an exact end-point, such as `dft['2013-1':'2013-2-28 00:00:00']`, the function will return all rows where the index is within the specified date range and includes the exact end-point. The result will be truncated to include only the data up to that point.",https://pandas.pydata.org/docs/user_guide/timeseries.html
