question,answer,source_page
How does pandas handle missing values when writing to JSON?,"Pandas converts NaN, NaT, and None to null, and datetime objects are converted based on the date_format and date_unit parameters. For example, if you have a DataFrame with a datetime column and you write it to JSON using the 'w' mode, the resulting JSON will contain the original datetime values.",https://pandas.pydata.org/docs/user_guide/io.html
What is the purpose of the `date_format` parameter when writing a DataFrame to JSON?,"The `date_format` parameter specifies how pandas should format datetime objects when writing a DataFrame to JSON. It allows you to control the output format, such as 'YYYY-MM-DD' or '%Y-%m-%d'. For instance, if your DataFrame contains a column with datetime values and you write it to JSON using the 'w' mode, specifying a date_format will result in a more human-readable output.",https://pandas.pydata.org/docs/user_guide/io.html
How does pandas serialize a DataFrame when using the 'columns' orientation?,"When using the 'columns' orientation, pandas serializes the data as nested JSON objects with column labels acting as the primary index. The resulting JSON will have the format: {{column1:{key1:value1,key2:value2}, column2:{key1:value1,key2:value2}}}. For example: {{A:{x:1,y:2,z:3},{B:{x:4,y:5,z:6},{C:{x:7,y:8,z:9}}}}.",https://pandas.pydata.org/docs/user_guide/io.html
What is the output when serializing a Series using the 'index' orientation?,"When serializing a Series using the 'index' orientation, pandas outputs a JSON object with the index labels as primary keys and column values as values. For example: {{x:15,y:16,z:17}}.",https://pandas.pydata.org/docs/user_guide/io.html
How does pandas serialize a DataFrame when using the 'records' orientation?,"When using the 'records' orientation, pandas serializes the data to a JSON array of column -> value records, index labels are not included. The resulting JSON will have the format: [{column1:value1,column2:value2},{column1:value3,column2:value4},...]. For example: [{A:1,B:4,C:7},{A:2,B:5,C:8},{A:3,B:6,C:9}}.",https://pandas.pydata.org/docs/user_guide/io.html
What is the default orientation for a DataFrame?,"The default orientation for a DataFrame is 'columns'. This means that column labels act as the primary index and are serialized first, followed by row values.",https://pandas.pydata.org/docs/user_guide/io.html
How do I write a date in the ISO format to use it as an index for data manipulation?,"You can write a date in the ISO format using the pd.Timestamp function. The resulting Timestamp object can be used as an index for data manipulation, such as sorting or grouping by date.",https://pandas.pydata.org/docs/user_guide/io.html
What is the difference between writing a date in 'iso' and 'us' format when calling to_json()?,"Writing a date in 'iso' format includes microseconds, while writing it in 'us' format does not. The 'us' format omits microseconds for brevity.",https://pandas.pydata.org/docs/user_guide/io.html
How do I write data to a file with a date index and a date column using to_json()?,"To write data to a file with a date index and a date column, you can use the to_json() function with the date_format parameter set to 'iso' and specify a file path. The resulting JSON file will include the date as an index and as a separate column.",https://pandas.pydata.org/docs/user_guide/io.html
What is the purpose of setting the date_unit parameter when calling to_json()?,"The date_unit parameter specifies whether to include microseconds in the ISO date format. Setting it to 'us' omits microseconds for brevity, while setting it to 'iso' includes them.",https://pandas.pydata.org/docs/user_guide/io.html
How do I use pd.Timestamp to create a date index and assign values to it?,"You can use the pd.Timestamp function to create a date index and assign values to it. The resulting Timestamp object can be used as an index for data manipulation, such as sorting or grouping by date.",https://pandas.pydata.org/docs/user_guide/io.html
How does pandas handle complex data types when serializing to JSON?,"If the JSON serializer cannot handle a container's contents, it will fall back and attempt to serialize each value individually. For complex data types like numpy.complex_, this means that the default_handler will be called for each value. The default_handler can convert these values to a format that can be serialized, such as converting complex numbers to strings in the format '(a+bj)'. This ensures that the JSON output is valid and can be deserialized correctly.",https://pandas.pydata.org/docs/user_guide/io.html
What happens when pandas encounters an object or dtype that cannot be directly serialized to JSON?,"If pandas encounters an object or dtype that cannot be directly serialized, it will attempt to convert it to a dictionary using its defined methods. If this fails, it will invoke the default_handler, if provided. In some cases, this may result in an OverflowError or unexpected results. Providing a custom default_handler can help mitigate these issues and ensure reliable serialization.",https://pandas.pydata.org/docs/user_guide/io.html
How does pandas handle missing data when serializing to JSON?,"When serializing to JSON, pandas will typically replace missing values with null strings ('null'). This ensures that the output is valid JSON and can be deserialized correctly. However, if a custom default_handler is provided, it may choose to represent missing values differently.",https://pandas.pydata.org/docs/user_guide/io.html
How do I read a JSON string into a pandas DataFrame?,You can use `pd.read_json()` function to read a JSON string into a pandas DataFrame. For example: `pd.read_json('data.json')`.,https://pandas.pydata.org/docs/user_guide/io.html
What happens when I specify the dtype argument while reading a JSON file?,"When you specify the dtype argument, pandas will convert the data types of the columns in the resulting DataFrame to the specified types. For example: `pd.read_json('data.json', dtype={'A': 'float32'})`.",https://pandas.pydata.org/docs/user_guide/io.html
How do I preserve string indices when reading a JSON file?,"You can use the `convert_axes=False` argument while reading a JSON file to preserve string indices. For example: `pd.read_json('data.json', convert_axes=False)`.",https://pandas.pydata.org/docs/user_guide/io.html
What is the default behavior of pandas when reading JSON files with timestamps?,"Pandas will automatically detect the precision of the timestamps in the JSON file. If you want to specify a different precision, you can use the `date_unit` argument while reading the JSON file. For example: `pd.read_json('data.json', date_unit='ns')`.",https://pandas.pydata.org/docs/user_guide/io.html
How do I control the default dtypes used for the resulting DataFrame when reading a JSON file?,"You can set the `dtype_backend` argument to control the default dtypes used for the resulting DataFrame. For example: `pd.read_json('data.json', dtype_backend='int64')`.",https://pandas.pydata.org/docs/user_guide/io.html
How can I convert a list of dictionaries with varying keys into a flat table?,"You can use the `normalize` function from pandas, which takes a dict or list of dicts and returns a DataFrame with a single column for each key in the original data. For example: `import pandas as pd; data = [{'name': 'John', 'age': 25}, {'name': 'Jane', 'city': 'New York'}]; normalized_data = pd.normalize(data); print(normalized_data)",https://pandas.pydata.org/docs/user_guide/io.html
How can I extract a specific column from a nested dictionary in a pandas DataFrame?,"You can use the `json_normalize` function with the `max_level` parameter to specify which level of nesting to normalize. For example, `pd.json_normalize(data, 'county', ['state', 'shortname'])` will return only the `name` and `population` columns from the nested dictionaries.",https://pandas.pydata.org/docs/user_guide/io.html
What is the purpose of the `json_normalize` function in pandas?,"The `json_normalize` function is used to convert a list of dictionaries into a flat table, where each dictionary represents a row. It can also be used to extract specific columns from nested dictionaries.",https://pandas.pydata.org/docs/user_guide/io.html
How do I specify which level of nesting to normalize when using the `json_normalize` function?,"You can use the `max_level` parameter to specify which level of nesting to normalize. For example, `pd.json_normalize(data, max_level=1)` will normalize only until the first nesting level of the provided dict.",https://pandas.pydata.org/docs/user_guide/io.html
Can I customize how data is normalized when using the `json_normalize` function?,"Yes, you can specify which columns to include or exclude from normalization by passing a list of column names. For example, `pd.json_normalize(data, 'county', ['state', 'shortname'])` will only normalize the `name` and `population` columns.",https://pandas.pydata.org/docs/user_guide/io.html
How can I convert a nested JSON object into a flat table with pandas?,"You can use the `pd.json_normalize()` function to achieve this. The result will be a new DataFrame where each key-value pair from the original JSON object becomes a separate row in the table, with the values at the next level of nesting becoming column names. For example:

pd.json_normalize(data, max_level=1)
Out[280]:
CreatedBy.Name    Lookup.TextField Lookup.UserField Image.a
0             User001       Some text   {'Id': 'ID001', 'Name': 'Name001'}     b",https://pandas.pydata.org/docs/user_guide/io.html
What is the purpose of the `max_level` parameter in `pd.json_normalize()`?,"The `max_level` parameter specifies how many levels of nesting to flatten. If you set it to 1, as shown in the example, each top-level key-value pair will become a separate row in the table. If you set it higher, more nested values will be included in the output. For instance, if you set `max_level=2`, the resulting DataFrame would have an additional column for each two-level nested value.

pd.json_normalize(data, max_level=2)
Out[281]:
CreatedBy.Name    Lookup.TextField Lookup.UserField Image.a
0             User001       Some text   {'Id': 'ID001', 'Name': 'Name001'}     b
Lookup.Id    Lookup.UserField.Id    Lookup.Image.a
1           ID001          ID001         a",https://pandas.pydata.org/docs/user_guide/io.html
"How can I read a large line-delimited JSON file using pandas, and what is the purpose of the `chunksize` parameter?","You can use `pd.read_json()` with the `lines=True` argument to read a line-delimited JSON file. The `chunksize` parameter allows you to specify how many lines to read at a time, which can be useful for large files or reading from a stream. For example: `df = pd.read_json('large_file.jsonl', lines=True, chunksize=1000)`.",https://pandas.pydata.org/docs/user_guide/io.html
"What is the difference between using `pd.read_json()` with and without the `lines=True` argument, and what does it affect in the resulting DataFrame?","Using `pd.read_json()` with `lines=True` tells pandas to read a line-delimited JSON file. Without `lines=True`, pandas will assume the data is in the standard JSON format (i.e., newline-separated values). The result of using `lines=True` is a DataFrame where each row represents a single JSON object, whereas without `lines=True`, the result would be a Series containing all the JSON objects as strings. For example: `df = pd.read_json('large_file.jsonl', lines=False)` will return a Series, while `df = pd.read_json('large_file.jsonl', lines=True)` will return a DataFrame: `df Out[284]: a b 0 1 2 1 3 4`.",https://pandas.pydata.org/docs/user_guide/io.html
"Can I use the `pyarrow` engine to read line-delimited JSON files, and what are its benefits?","Yes, you can use the `pyarrow` engine to read line-delimited JSON files. The `pyarrow` engine is faster than the default `json` engine for large files because it uses a more efficient data structure internally. To use the `pyarrow` engine, specify `engine='pyarrow'` when calling `pd.read_json()`. For example: `df = pd.read_json('large_file.jsonl', lines=True, engine='pyarrow')`.",https://pandas.pydata.org/docs/user_guide/io.html
How can I create a pandas Series with a period index that represents quarterly data?,"You can create a pandas Series with a period index using pd.period_range(). For example, to represent quarterly data from 2016 to 2019, you can use pd.period_range('2016', freq='Q-DEC', periods=4). This will return a Series with a datetime index representing the quarter of each year and an integer column for the values.",https://pandas.pydata.org/docs/user_guide/io.html
What is the purpose of the 'freq' parameter in pandas period_range()?,"The 'freq' parameter specifies the frequency of the period index. For example, if you set freq='Y-DEC', it will return a Series with a datetime index representing the last day of each year and an integer column for the values.",https://pandas.pydata.org/docs/user_guide/io.html
How does pandas determine the primary key in a table schema?,"The primary key in a table schema is determined based on the uniqueness of the index. If the index is unique, a primaryKey field containing an array of labels is included. This behavior applies to both Series and DataFrames with MultiIndexes.",https://pandas.pydata.org/docs/user_guide/io.html
What happens when there are duplicate values in the index of a DataFrame?,"When there are duplicate values in the index of a DataFrame, the primaryKey field will only contain the unique values from the index. For example, if the index contains both 'a' and 'b', but the value 'a' appears twice, only 'a' will be included in the primaryKey field.",https://pandas.pydata.org/docs/user_guide/io.html
How does pandas handle MultiIndexes when building a table schema?,"When building a table schema for a DataFrame with a MultiIndex, the primaryKey field will contain an array of labels. The order and type of these labels depend on the MultiIndex. For example, if the MultiIndex has two levels ('level_0' and 'level_1'), both of these will be included in the primaryKey field.",https://pandas.pydata.org/docs/user_guide/io.html
What is the default naming convention for columns in a DataFrame table schema?,"The default naming convention for columns in a DataFrame table schema follows these rules: series - object.name (or values if object.name is None), DataFrames - stringified column name, Index (not MultiIndex) - index.name (or index if index.name is None), MultiIndex - mi.names",https://pandas.pydata.org/docs/user_guide/io.html
How does pandas handle user-defined ExtensionArray when using orient='table' for JSON serialization?,"When using orient='table' along with user-defined ExtensionArray, the generated schema will contain an additional extDtype key in the respective fields element. This extra key is not standard but enables JSON roundtrips for extension types.",https://pandas.pydata.org/docs/user_guide/io.html
What happens to the index name when reading a JSON file created with pandas' to_json() method?,"The index name from the original DataFrame is preserved in the read JSON file, as shown by printing the index name after reading the file.",https://pandas.pydata.org/docs/user_guide/io.html
How do I read a URL and match a table that contains specific text in pandas?,"You can use the `read_html` function with the `match` parameter set to your desired text. For example, `match = 'Metcalf Bank' df_list = pd.read_html(url, match=match)`. The result is a list of dataframes that contain the matched table(s).",https://pandas.pydata.org/docs/user_guide/io.html
How do I specify a header row when reading HTML tables in pandas?,"You can use the `header` parameter to specify which row to use as the header. For example, `dfs = pd.read_html(url, header=0)`. If no header is specified, pandas will automatically detect and use the first row with `<th>` elements. The result is a dataframe with the specified header row.",https://pandas.pydata.org/docs/user_guide/io.html
How do I specify an index column when reading HTML tables in pandas?,"You can use the `index_col` parameter to specify which column to use as the index. For example, `dfs = pd.read_html(url, index_col=0)`. The result is a dataframe with the specified column as the index.",https://pandas.pydata.org/docs/user_guide/io.html
How do I skip rows when reading HTML tables in pandas?,"You can use the `skiprows` parameter to specify how many rows to skip at the beginning of each table. For example, `dfs = pd.read_html(url, skiprows=range(2))`. The result is a dataframe with the specified number of rows skipped.",https://pandas.pydata.org/docs/user_guide/io.html
How do I convert a pandas Series to a string representation?,"You can use the `astype` method with the object data type: `s.astype('string')`. This will return a new Series with the same values as the original, but in a format that can be used in strings. For example:
s = pd.Series([1, 2, 3])
s = s.astype('string')
print(s)
# Output: '1
2
3'",https://pandas.pydata.org/docs/user_guide/io.html
How do I write a pandas DataFrame to an HTML file?,"You can use the `to_html` method with the `index` parameter set to `True` and the `header` parameter set to `False`. For example:
import pandas as pd
df = pd.DataFrame({'Name': ['John', 'Mary'], 'Age': [25, 31]})
df.to_html('output.html', index=True, header=False)
# Output: an HTML file named 'output.html' with the DataFrame rendered as a table",https://pandas.pydata.org/docs/user_guide/io.html
How can I customize the appearance of a pandas DataFrame when writing it to an HTML file?,"You can use the `to_html` method with various arguments, such as `columns`, `float_format`, and `bold_rows`. For example, you can specify which columns to show, control the precision of floating point values, or make row labels bold by default. The resulting HTML table will have a CSS class that matches the specified value.",https://pandas.pydata.org/docs/user_guide/io.html
What is the purpose of the `classes` argument in the `to_html` method?,"The `classes` argument allows you to give the resulting HTML table a specific CSS class, which can be used for styling or other purposes. This can help make your output more visually appealing and consistent with your project's design.",https://pandas.pydata.org/docs/user_guide/io.html
How do I control the precision of floating point values when writing a DataFrame to an HTML file?,"You can use the `float_format` argument in the `to_html` method to specify a Python callable that controls the precision of floating point values. For example, you can use `{0:.10f}` to display values with up to 10 decimal places.",https://pandas.pydata.org/docs/user_guide/io.html
Can I customize the appearance of a pandas DataFrame when displaying it using the `display` function?,"No, the `display` function does not allow customization of the DataFrame's appearance. However, you can use the `to_html` method and then display the resulting HTML table to achieve similar results.",https://pandas.pydata.org/docs/user_guide/io.html
How do I make row labels bold by default when writing a DataFrame to an HTML file?,You can use the `bold_rows` argument in the `to_html` method to make row labels bold by default. You can also turn this off by passing `False` as the value.,https://pandas.pydata.org/docs/user_guide/io.html
How can I determine if a pandas DataFrame is slow to parse HTML tables?,"The biggest drawback of using html5lib is that it is slow as molasses. However, for most small to medium-sized tables on the web, the bottleneck will be in reading the raw text from the URL over the web, i.e., IO (input-output). To check if your DataFrame is slow, try parsing a smaller table or one with fewer rows.",https://pandas.pydata.org/docs/user_guide/io.html
How can I optimize pandas parsing of HTML tables for large datasets?,"For very large tables, the bottleneck will be in reading the raw text from the URL over the web. You can try using other libraries like html5lib's faster alternatives, or consider caching or parallelizing the parsing process.",https://pandas.pydata.org/docs/user_guide/io.html
How can I use pandas to output data in LaTeX format?,"You can use the `to_latex()` method of a DataFrame or Styler object. This will generate a LaTeX table that you can include in your document. The resulting LaTeX code includes conditional styling options, making it easy to customize the appearance of your tables.",https://pandas.pydata.org/docs/user_guide/io.html
How do I add currency symbols to values in a pandas DataFrame before outputting it in LaTeX format?,"You can use the `format()` method of a Styler object to apply formatting to your data. For example, to add Euro currency symbols, you would chain the `format('€ {}')` method after `to_latex()`. This will result in a LaTeX table with formatted values.",https://pandas.pydata.org/docs/user_guide/io.html
How can I merge two DataFrames with a common column to create a new DataFrame?,"You can use the `merge()` function with the 'inner' parameter set to True, like this: `pd.merge(df1, df2, on='common_column')`. This will return a new DataFrame with only the rows where the values in the 'common_column' match.",https://pandas.pydata.org/docs/user_guide/merging.html
How do I concatenate two Series objects along their index?,"You can use the `concat()` function like this: `pd.concat([s1, s2])`. The result is a new Series object with the values from both input Series in the same order.",https://pandas.pydata.org/docs/user_guide/merging.html
How do I concatenate two DataFrames to merge their rows?,"You can use the concat() function, which makes a full copy of the data and returns a new DataFrame with the combined rows. For example: df1 = pd.DataFrame({'A': [1, 2], 'B': [3, 4]})
df2 = pd.DataFrame({'A': [5, 6], 'B': [7, 8]})
result = pd.concat([df1, df2])
print(result)
# Output:
   A  B
0  1  3
1  2  4
2  5  7
3  6  8",https://pandas.pydata.org/docs/user_guide/merging.html
What happens when I use concat() on multiple DataFrames with different indexes?,"When you use concat() on multiple DataFrames with different indexes, it performs set logic (union or intersection) of the indexes on the other axes. For example: df1 = pd.DataFrame({'A': [1, 2], 'B': [3, 4]})
df2 = pd.DataFrame({'A': [5, 6], 'B': [7, 8]}, index=[0, 1])
result = pd.concat([df1, df2])
print(result)
# Output:
   A  B
0  1  3
1  2  4
2  5  7",https://pandas.pydata.org/docs/user_guide/merging.html
Can I use concat() to merge two Series objects?,"Yes, you can use concat() to merge two Series objects along an axis. For example: s1 = pd.Series([1, 2])
s2 = pd.Series([3, 4])
result = pd.concat([s1, s2], axis=0)
print(result)
# Output:
0    1
1    2
2    3
3    4",https://pandas.pydata.org/docs/user_guide/merging.html
How can I avoid creating unnecessary copies when using concat()?,"To avoid creating unnecessary copies when using concat(), collect all DataFrame or Series objects in a list before using concat(). This ensures that only one copy of the data is created. For example: df1 = pd.DataFrame({'A': [1, 2], 'B': [3, 4]})
df2 = pd.DataFrame({'A': [5, 6], 'B': [7, 8]})
frames = [df1, df2]
result = pd.concat(frames)
print(result)",https://pandas.pydata.org/docs/user_guide/merging.html
How does pandas handle index/column names when concatenating DataFrames with different axes?,"When concatenating DataFrame with named axes, pandas will attempt to preserve these index/column names whenever possible. If all inputs share a common name, this name will be assigned to the result. If the input names do not all agree, the result will be unnamed.",https://pandas.pydata.org/docs/user_guide/merging.html
What happens when you concatenate DataFrames with MultiIndex and different levels have conflicting axis names?,"The same logic is applied separately on a level-by-level basis. When concatenating DataFrame with named axes, pandas will attempt to preserve these index/column names whenever possible.",https://pandas.pydata.org/docs/user_guide/merging.html
"How can I concatenate a DataFrame with a Series, and what is the default behavior for the resulting DataFrames?","When concatenating a DataFrame with a Series, the Series will be transformed to a DataFrame with the column name as the name of the Series. The default behavior is to assign an index to the resulting DataFrames, unless you specify ignore_index=True.",https://pandas.pydata.org/docs/user_guide/merging.html
What happens when I concatenate two DataFrames that have overlapping indexes?,"When concatenating two DataFrames that have overlapping indexes, pandas will ignore the indexes and create a new index for the resulting DataFrame. This can be achieved using the ignore_index parameter, which is set to True by default.",https://pandas.pydata.org/docs/user_guide/merging.html
Can I concatenate a mix of Series and DataFrame objects together in one operation?,"Yes, you can concatenate a mix of Series and DataFrame objects together in one operation. The Series will be transformed to a DataFrame with the column name as the name of the Series, and the resulting DataFrames will have an assigned index unless ignore_index=True is specified.",https://pandas.pydata.org/docs/user_guide/merging.html
How can I concatenate multiple DataFrames horizontally?,"You can use the pd.concat() function with the axis=1 parameter to concatenate DataFrames horizontally. For example: s3 = pd.Series([0, 1, 2, 3], name='foo'); s4 = pd.Series([0, 1, 2, 3]); s5 = pd.Series([0, 1, 4, 5]); pd.concat([s3, s4, s5], axis=1)",https://pandas.pydata.org/docs/user_guide/merging.html
