question,answer,source_page
Can you use slices with the get() method on a Series?,"No, the get() method does not support slicing. However, if you try to access an index that is iterable (like a list), pandas will still work around it by converting the generator to a list before going through the hashable part.",https://pandas.pydata.org/docs/user_guide/dsintro.html
How can you convert a Series to a specific type of data?,"You can use the astype() method to convert a Series to a specific type of data. For example, s.astype(int) would convert the Series to integers.",https://pandas.pydata.org/docs/user_guide/dsintro.html
How can I assign a name to a pandas Series?,"You can assign a name to a pandas Series using the `name` parameter when creating it, or by renaming it later using the `rename()` method. For example: In [1]: import numpy as np; import pandas as pd
In [2]: s = pd.Series(np.random.randn(5), name='something')
In [3]: s.name
Out[3]: 'something'
You can also rename a Series with the `rename()` method, like this: In [4]: s.rename('different')
In [5]: s2 = s
Out[5]: different",https://pandas.pydata.org/docs/user_guide/dsintro.html
What is the difference between passing an index and columns when creating a pandas DataFrame?,"When creating a pandas DataFrame, you can optionally pass an index (row labels) and columns (column labels) arguments. If you pass both, the resulting DataFrame will have the specified index and columns, discarding any data that doesn't match up to the passed index or columns. For example: In [1]: import pandas as pd
In [2]: df = pd.DataFrame({'A': [1, 2, 3]}, index=['a', 'b', 'c'])
In [3]: df
Out[3]:    A
a   1
b   2
c   3",https://pandas.pydata.org/docs/user_guide/dsintro.html
How can I create a MultiIndexed DataFrame from a dictionary of tuples?,"You can use the `pd.DataFrame()` function with a tuples dictionary to automatically create a MultiIndexed frame. The resulting DataFrame will have a hierarchical index with the first level being the outermost tuple keys and the second level being the inner tuple keys. For example, if your input dictionary is `{('a', 'b'): {('A', 'B'): 1, ('A', 'C'): 2}, ('a', 'a'): {('A', 'C'): 3, ('A', 'B'): 4}, ('a', 'c'): {('A', 'B'): 5, ('A', 'C'): 6}, ('b', 'a'): {('A', 'C'): 7, ('A', 'B'): 8}, ('b', 'b'): {('A', 'D'): 9, ('A', 'B'): 10}}`, the resulting DataFrame will be:

a b b a c a b
1.0 4.0 5.0 8.0 10.0 C 2.0 3.0 6.0 7.0 NaN D NaN NaN NaN NaN 9.0",https://pandas.pydata.org/docs/user_guide/dsintro.html
How can I convert a Series to a DataFrame with the same index and one column?,"You can use the `pd.DataFrame()` function with the original Series as input, specifying its name only if desired. The resulting DataFrame will have the same index as the input Series and one column whose name is the original name of the Series. For example, if you have a Series like `ser = pd.Series(range(3), index=list('abc'), name='ser')`, the resulting DataFrame will be:

ser a 0 b 1 c 2",https://pandas.pydata.org/docs/user_guide/dsintro.html
How can I create a pandas DataFrame from a list of custom dataclasses?,"You can pass a list of dataclasses directly to the DataFrame constructor. For example, if you have a custom Point class with 'x' and 'y' attributes, you can create a DataFrame like this: `pd.DataFrame([Point(0, 0), Point(0, 3), Point(2, 3)])`. This will result in a DataFrame with the same number of rows as your list of dataclasses, and columns corresponding to the class's attributes.",https://pandas.pydata.org/docs/user_guide/dsintro.html
What happens when I pass a list containing mixed types to the DataFrame constructor?,"If you pass a list containing mixed types to the DataFrame constructor, it will raise a TypeError. For example, if you try `pd.DataFrame([1, 'a', 3.0])`, pandas will throw an error because it expects all values in the list to be of the same type.",https://pandas.pydata.org/docs/user_guide/dsintro.html
How can I create a pandas DataFrame from a dictionary where the keys are column names and the values are lists of data?,"You can use the `DataFrame.from_dict()` constructor with the `orient='columns'` parameter set to 'index'. This will create a DataFrame where the dictionary keys become row labels. For example, `pd.DataFrame.from_dict(dict([('A', [1, 2, 3]), ('B', [4, 5, 6])]))` creates a DataFrame with column names 'A' and 'B' and data in rows 0-2.",https://pandas.pydata.org/docs/user_guide/dsintro.html
Can I specify the column names when creating a pandas DataFrame from a dictionary where the keys are column names and the values are lists of data?,"Yes, you can use the `DataFrame.from_dict()` constructor with the `orient='index'` parameter set to 'columns'. This will allow you to pass custom column names. For example, `pd.DataFrame.from_dict(dict([('A', [1, 2, 3]), ('B', [4, 5, 6])]), orient='index', columns=['one', 'two', 'three'])` creates a DataFrame with column names 'one', 'two', and 'three' and data in rows 0-2.",https://pandas.pydata.org/docs/user_guide/dsintro.html
How can I create a pandas DataFrame from a list of tuples or an ndarray with structured dtype?,"You can use the `DataFrame.from_records()` constructor. This will create a DataFrame where the first element of each tuple becomes the index value and the remaining elements become column values. For example, `pd.DataFrame.from_records([(1, 2., b'Hello'), (2, 3., b'World')], index='C')` creates a DataFrame with an 'A' column containing integers, a 'B' column containing floats, and a 'C' column containing strings.",https://pandas.pydata.org/docs/user_guide/dsintro.html
What is the difference between `DataFrame.from_dict()` and `DataFrame.from_records()`?,"The main difference is that `DataFrame.from_dict()` creates a DataFrame from a dictionary where the keys are column names and the values are lists of data, while `DataFrame.from_records()` creates a DataFrame from a list of tuples or an ndarray with structured dtype. In both cases, you can specify custom column names or index labels.",https://pandas.pydata.org/docs/user_guide/dsintro.html
How do you add a new column to a pandas DataFrame with scalar values?,"When inserting a scalar value into a DataFrame, it will naturally be propagated to fill the column. For example: df['foo'] = 'bar'",https://pandas.pydata.org/docs/user_guide/dsintro.html
What happens when you insert a Series that does not have the same index as the DataFrame?,"When inserting a Series that does not have the same index as the DataFrame, it will be conformed to the DataFrame's index. For example: df['one_trunc'] = df['one'][:2]",https://pandas.pydata.org/docs/user_guide/dsintro.html
How do you delete or remove columns from a pandas DataFrame?,"Columns can be deleted or popped like with a dict. For example: del df['two'], three = df.pop('three')",https://pandas.pydata.org/docs/user_guide/dsintro.html
Can you insert raw ndarrays into a pandas DataFrame and control their position?,"Yes, you can insert raw ndarrays but their length must match the length of the DataFrame's index. By default, columns get inserted at the end.",https://pandas.pydata.org/docs/user_guide/dsintro.html
How does pandas insert a new column at a specific position in a DataFrame?,"The `insert()` function inserts a new column at the specified position, shifting all columns to the right of the insertion point. The result is a new DataFrame with the inserted column.",https://pandas.pydata.org/docs/user_guide/dsintro.html
"What happens when you use `df.insert(1, 'bar', df['one'])'?","The code creates a new column named 'bar' and inserts it at position 1 in the DataFrame, replacing the existing column at that position. The resulting DataFrame has two columns: 'one' and 'bar'.",https://pandas.pydata.org/docs/user_guide/dsintro.html
How do I create a new column that is the ratio of SepalWidth to SepalLength for each row in an iris dataset?,"You can use the `assign` method and pass a function that takes one argument, like this: `iris.assign(sepal_ratio=lambda x: x['SepalWidth'] / x['SepalLength'])`. This will create a new column called 'sepal_ratio' with the calculated values.",https://pandas.pydata.org/docs/user_guide/dsintro.html
What is the purpose of using a lambda function when assigning a new column in pandas?,"A lambda function allows you to perform an operation on each row of the DataFrame without having to define a separate named function. In this case, it's used to calculate the ratio of SepalWidth to SepalLength.",https://pandas.pydata.org/docs/user_guide/dsintro.html
How do I insert a calculated value into a new column when using the `assign` method?,"You can pass a precomputed value directly, like this: `iris.assign(sepal_ratio=iris['SepalWidth'] / iris['SepalLength'])`. This will create a new column with the same values as the ratio calculation.",https://pandas.pydata.org/docs/user_guide/dsintro.html
How does pandas' assign method return a copy of the data?,"pandas' assign method returns a copy of the data, leaving the original DataFrame untouched. This can be useful when you don't have a reference to the DataFrame at hand.",https://pandas.pydata.org/docs/user_guide/dsintro.html
What is the difference between using assign() with a lambda function and using it with pd.col()? Can you provide an example?,"Using assign() with a lambda function allows you to pass a callable, while using it with pd.col() requires actual values. The example code shows how both methods produce the same result: assigning a new column 'sepal_ratio' to the DataFrame iris, calculating the ratio of 'SepalWidth' and 'SepalLength'.",https://pandas.pydata.org/docs/user_guide/dsintro.html
How can you use assign() in a chain of operations?,"You can use assign() in a chain of operations by passing it as part of a method call that returns a DataFrame, such as when using the head() or tail() methods. This allows you to perform multiple assignments on the same DataFrame without having to reassign it to a new variable.",https://pandas.pydata.org/docs/user_guide/dsintro.html
How can I add two columns to a DataFrame using method chaining?,"You can use the assign method in pandas. This method returns a new DataFrame with the added column(s). For example, df.assign(C=lambda x: x['A'] + x['B'], D=lambda x: x['A'] + x['C']). The result is a new DataFrame where 'C' and 'D' are the sum of 'A' and 'B', and 'A' and 'C', respectively.",https://pandas.pydata.org/docs/user_guide/dsintro.html
What happens when I use a lambda function to add two columns in method chaining?,"When you use a lambda function, it creates a new column with a default value. In this case, x['C'] refers to the newly created column, which is equal to df['A'] + df['B']. The result is a DataFrame where 'C' and 'D' are the sum of 'A' and 'B', and 'A' and 'C', respectively.",https://pandas.pydata.org/docs/user_guide/dsintro.html
How can I select only specific rows from a DataFrame?,"You can use the loc or iloc method along with boolean indexing to select rows. For example, df[5:10] will return all rows between index 5 and 10 (inclusive). This will give you a new DataFrame containing those rows.",https://pandas.pydata.org/docs/user_guide/dsintro.html
What happens when I select a row by its label using df.loc[label]?,"When you use df.loc[label], it returns a Series whose index is the columns of the DataFrame. The result is a single row from the original DataFrame, where the index matches the specified label.",https://pandas.pydata.org/docs/user_guide/dsintro.html
How does pandas automatically align DataFrames when performing arithmetic operations?,"When performing arithmetic operations between two DataFrame objects, pandas automatically aligns them on both columns and row labels, resulting in a new DataFrame with the union of column and row labels. This means that if one DataFrame has more rows or columns than the other, the extra values will be filled with NaN (Not a Number) values.",https://pandas.pydata.org/docs/user_guide/dsintro.html
What happens when you perform an operation between a DataFrame and a Series?,"When performing an operation between a DataFrame and a Series, pandas broadcasts the Series index on the DataFrame columns, effectively aligning them row-wise. This means that if the Series has more rows than the DataFrame, it will be repeated for each row in the DataFrame.",https://pandas.pydata.org/docs/user_guide/dsintro.html
How do you control the matching and broadcasting behavior when performing binary operations between DataFrames?,"For explicit control over the matching and broadcasting behavior, see the section on flexible binary operations. This allows you to customize how pandas aligns and combines DataFrames and Series during arithmetic operations.",https://pandas.pydata.org/docs/user_guide/dsintro.html
What is the result of subtracting a row from a DataFrame using the - operator?,"The result of subtracting a row from a DataFrame using the - operator is a new Series, where each element in the resulting Series represents the difference between the corresponding elements in the original DataFrame and the specified row. The resulting Series will have the same index as the original DataFrame.",https://pandas.pydata.org/docs/user_guide/dsintro.html
How can I swap the rows and columns of a DataFrame?,"To transpose, access the T attribute or use DataFrame.transpose(). The result is a new DataFrame with the same data but with row and column indices swapped. For example:

In [1]: import pandas as pd
data = pd.DataFrame({'A': [1, 2, 3], 'B': [4, 5, 6]})
data.T
Out[1]: 
    A   B
0  1   4
1  2   5
2  3   6",https://pandas.pydata.org/docs/user_guide/dsintro.html
How does pandas handle alignment of multiple Series when applying a ufunc?,"When applying a ufunc to multiple Series, pandas aligns them before performing the operation. This means that if one or more Series have different labels (indexes), they are aligned according to their common labels. For example, using numpy.remainder() on two Series with differently ordered labels will align before the operation.",https://pandas.pydata.org/docs/user_guide/dsintro.html
What happens when a binary ufunc is applied to a pandas Series and Index?,"When a binary ufunc is applied to a pandas Series and Index, the Series implementation takes precedence. A Series is returned as a result of the operation.",https://pandas.pydata.org/docs/user_guide/dsintro.html
How does numpy.remainder() behave when applied to two pandas Series with different labels?,"Using numpy.remainder() on two pandas Series with differently ordered labels will align before performing the operation. The union of the two indices is taken, and non-overlapping values are filled with missing values.",https://pandas.pydata.org/docs/user_guide/dsintro.html
What does numpy.remainder() do when one or more of the input Series have different labels?,"When one or more of the input Series have different labels, the Series implementation takes precedence. Non-overlapping values from the other Series are filled with missing values.",https://pandas.pydata.org/docs/user_guide/dsintro.html
How does pandas handle maximum value selection when using NumPy ufuncs?,"When using NumPy ufuncs with pandas Series, the result will be a new Series with the same index as the original Series and the maximum values selected from each row. For example, if you have a Series with mixed data types, the ufunc will apply to only numeric columns, resulting in a Series with those values. The output dtype is always int64 for integer ufuncs and float64 for floating-point ufuncs.",https://pandas.pydata.org/docs/user_guide/dsintro.html
What happens when applying NumPy ufuncs to pandas Series backed by non-ndarray arrays?,"NumPy ufuncs are safe to apply to Series backed by non-ndarray arrays, such as SparseArray. In this case, the ufunc is applied without converting the underlying data to an ndarray. This can be beneficial for performance and memory efficiency when working with large datasets.",https://pandas.pydata.org/docs/user_guide/dsintro.html
How can I display a large DataFrame in the console without it getting truncated?,"You can use the `info()` method to get a summary of the DataFrame, or you can set the display options using `pd.set_option('display.max_rows', None)` and `pd.set_option('display.width', None)`. For example: `baseball = pd.read_csv('data/baseball.csv'); pd.set_option('display.max_rows', None); pd.set_option('display.width', None); print(baseball)",https://pandas.pydata.org/docs/user_guide/dsintro.html
What is the purpose of the `max_rows` and `max_width` options when setting display options for a DataFrame?,"These options control how much data is displayed in the console. Setting `max_rows=None` will display all rows, while setting `max_width=None` will display all columns. For example: `baseball = pd.read_csv('data/baseball.csv'); baseball.info()",https://pandas.pydata.org/docs/user_guide/dsintro.html
How can I display a pandas DataFrame with longer column names on a console output?,"By setting the `display.max_colwidth` option to a higher value, you can display DataFrames with longer column names. Try running `pd.set_option('display.max_colwidth', 100)` and then create a DataFrame like `pd.DataFrame({'long_column_name': [1, 2], 'short_column_name': [3, 4]})`. The output will show the long column name.",https://pandas.pydata.org/docs/user_guide/dsintro.html
Can I control the way a pandas DataFrame is displayed in the console?,"Yes, you can disable the automatic framing of DataFrames by setting the `expand_frame_repr` option to `False`. Try running `pd.set_option('expand_frame_repr', False)` and then create a DataFrame like `pd.DataFrame({'column1': [1, 2], 'column2': [3, 4]})`. The output will show the table in one block.",https://pandas.pydata.org/docs/user_guide/dsintro.html
How does pandas handle duplicate row labels in a DataFrame?,"When there are duplicate row labels, pandas will automatically assign the next integer value to create unique indices. For example, if you have a DataFrame with two rows having the same label, one of them might be assigned an index of 0 and the other an index of 1.",https://pandas.pydata.org/docs/user_guide/duplicates.html
What happens when you perform operations on DataFrames with duplicate labels?,"Performing operations like merging or grouping can produce unexpected results if there are duplicate labels. For instance, if you try to merge two DataFrames based on a column with duplicate labels, pandas will only keep the first occurrence of each label. To avoid this, you can use the drop_duplicates function to remove duplicate rows before performing the operation.",https://pandas.pydata.org/docs/user_guide/duplicates.html
What happens when you try to reindex a pandas Series with duplicate labels?,"When you try to reindex a pandas Series with duplicate labels, pandas raises a ValueError because the output cannot be determined. For example, if you have a Series s1 = pd.Series([0, 1, 2], index=['a', 'b', 'b']) and you try to reindex it with a new index ['a', 'b', 'c'], pandas will raise an error.",https://pandas.pydata.org/docs/user_guide/duplicates.html
How can you handle duplicate labels when reindexing a pandas Series?,"To handle duplicate labels, you can use the 'fill_value' parameter in the reindex method. For example: s1 = pd.Series([0, 1, 2], index=['a', 'b', 'b']); s1.reindex(['a', 'b', 'c'], fill_value='NaN') This will replace duplicate labels with NaN values.",https://pandas.pydata.org/docs/user_guide/duplicates.html
What happens when you try to reindex a DataFrame with duplicate labels?,"If the new index has duplicate labels, pandas will raise a ValueError. This is because pandas uses unique labels for indexing and reindexing.",https://pandas.pydata.org/docs/user_guide/duplicates.html
How can you handle duplicate labels when reindexing a DataFrame?,"You can use the `method='reindex'` parameter to specify how to handle duplicate labels. For example, you can set `limit=1` to only keep the first occurrence of each label.",https://pandas.pydata.org/docs/user_guide/duplicates.html
What is the purpose of the `tolerance` parameter when reindexing a DataFrame?,"The `tolerance` parameter specifies the maximum difference between the new index and the original index. If the tolerance is set too high, pandas may not be able to find a matching label in the new index.",https://pandas.pydata.org/docs/user_guide/duplicates.html
Can you reindex a MultiIndex DataFrame with duplicate labels on one of its axes?,"No, if there are duplicate labels on any axis of a MultiIndex DataFrame, pandas will raise a ValueError. However, you can use the `method='reindex'` parameter to specify how to handle these duplicate labels.",https://pandas.pydata.org/docs/user_guide/duplicates.html
How do you reindex a DataFrame with missing values?,"You can use the `fill_value` parameter to specify what value should be used to fill missing values in the new index. For example, you can set `fill_value='NaN'` to replace missing values with NaN.",https://pandas.pydata.org/docs/user_guide/duplicates.html
How can I remove duplicate rows from a DataFrame when the index is also duplicated?,You can use the `drop_duplicates` method with the `subset=False` parameter to remove duplicate rows based on all columns. The result will be a new DataFrame without duplicates. For example: df.drop_duplicates(),https://pandas.pydata.org/docs/user_guide/duplicates.html
"What happens if I slice a Series with a scalar value, and what does it return?","Slicing a Series with a scalar value returns a single value. If the original Series had duplicate values, this will be one of them. For instance: s = pd.Series([1, 2, 3]); s[5]",https://pandas.pydata.org/docs/user_guide/duplicates.html
How can I select all rows from a DataFrame where a specific column has a certain value?,You can use the `loc` method with label-based indexing to achieve this. For example: df.loc[df['A'] == 0],https://pandas.pydata.org/docs/user_guide/duplicates.html
How can I check if an index has unique labels?,"You can use the Index.is_unique method to check if an index has unique labels. This will return True if all labels are unique, and False otherwise.",https://pandas.pydata.org/docs/user_guide/duplicates.html
What is the purpose of the Index.duplicated() function in pandas?,Index.duplicated() returns a boolean array indicating whether each label in the index is duplicated. You can use this to drop duplicate rows from your DataFrame.,https://pandas.pydata.org/docs/user_guide/duplicates.html
How do I handle duplicate labels in an index when using groupby()?,"When using groupby() on an index with duplicate labels, you can resolve duplicates by taking the average of all rows with the same label. You can use the mean() method to achieve this.",https://pandas.pydata.org/docs/user_guide/duplicates.html
How can I ensure my DataFrame doesn't allow duplicate labels when reading in messy data?,"You can use the set_flags method to return a new DataFrame with allows_duplicate_labels set to False, or you can set this attribute directly on the original DataFrame. When processing raw data, it's common to first read in the data, remove duplicates using groupby and first(), and then disallow duplicates going forward by setting allows_duplicate_labels to False.",https://pandas.pydata.org/docs/user_guide/duplicates.html
What happens if I try to set allows_duplicate_labels=False on a Series or DataFrame with duplicate labels?,Setting allows_duplicate_labels=False on such an object will raise a DuplicateLabelError. This is because allowing duplicates in the first place can lead to unexpected behavior and errors down the line.,https://pandas.pydata.org/docs/user_guide/duplicates.html
How do I know if my DataFrame has allowed duplicate labels?,"You can check the flags of your DataFrame using its attributes, specifically flags.allows_duplicate_labels. If this attribute returns True, then the DataFrame allows duplicate labels; otherwise, it does not.",https://pandas.pydata.org/docs/user_guide/duplicates.html
Can I set allows_duplicate_labels=True on a Series or DataFrame that already disallows duplicates?,"No, attempting to do so will raise an error. This is because setting allows_duplicate_labels=True would reintroduce duplicate labels into the data, which could lead to unexpected behavior and errors.",https://pandas.pydata.org/docs/user_guide/duplicates.html
What happens when I try to rename a column with a duplicate label in my DataFrame?,"If you try to rename a column with a duplicate label, pandas will raise a DuplicateLabelError. This is because pandas uses labels as indices for DataFrames and Series, so having multiple columns with the same name would cause confusion. The error message indicates that the operation was attempted on a copy of the original DataFrame, rather than the original, to avoid modifying it in-place.",https://pandas.pydata.org/docs/user_guide/duplicates.html
How can I rename columns in my DataFrame while keeping the original column names?,"You can use the `rename` method with the `axis=1` parameter set to `False`, like this: `df.rename(columns={'old_name': 'new_name'})`. This will return a new DataFrame with the renamed columns, without modifying the original. The result looks something like this:

| old_name | new_name |
---------|----------|
 1       | 2        |
 3       | 4        |",https://pandas.pydata.org/docs/user_guide/duplicates.html
