question,answer,source_page
What is the purpose of using pandas' where() method?,The where() method is used to set values in a DataFrame based on some boolean criteria. It returns a modified copy of the data.,https://pandas.pydata.org/docs/user_guide/indexing.html
How does the where() method handle missing values?,"The where() method replaces missing values (NaN) with another value, which can be specified as the second argument. If no value is provided, it will replace NaN with zero by default.",https://pandas.pydata.org/docs/user_guide/indexing.html
What is the difference between using where() and assigning a new value to a column directly?,"Using where() creates a modified copy of the original DataFrame, whereas assigning a new value to a column directly modifies the original DataFrame. This can have implications for data integrity and performance.",https://pandas.pydata.org/docs/user_guide/indexing.html
Can the where() method be used with other pandas functions or methods?,"Yes, the where() method can be combined with other pandas functions or methods, such as mask(), loc[], and iloc[] to perform more complex data manipulation tasks.",https://pandas.pydata.org/docs/user_guide/indexing.html
What is the purpose of the axis parameter in pandas' where() function?,The axis parameter specifies whether the input boolean condition should be applied along the rows (axis=0) or columns (axis=1).,https://pandas.pydata.org/docs/user_guide/indexing.html
How does pandas' where() function handle partial selection with setting?,"Pandas' where() function allows for partial selection with setting, similar to .loc on the contents rather than the axis labels. This means that only the specified rows are affected by the operation.",https://pandas.pydata.org/docs/user_guide/indexing.html
What additional parameters can be passed to pandas' where() function to align the input?,"The where() function can also accept level parameters to align the input when performing the operation, allowing for more flexibility in selecting data.",https://pandas.pydata.org/docs/user_guide/indexing.html
What is the purpose of the where() method in pandas?,The where() method is used to apply a condition to each element of a Series or DataFrame and replace values outside the condition with another value.,https://pandas.pydata.org/docs/user_guide/indexing.html
How does the where() method handle missing values?,"The where() method can be configured to treat NaN (missing) values in a specific way, either as if they were False in the condition or as if they were True.",https://pandas.pydata.org/docs/user_guide/indexing.html
Can the where() method accept a callable as the condition?,"Yes, the where() method can accept a callable function as the condition. The function must take one argument (the Series or DataFrame) and return a valid boolean value as the condition and another value as the replacement.",https://pandas.pydata.org/docs/user_guide/indexing.html
What is the difference between using where() with a scalar value versus a callable function?,"Using where() with a scalar value replaces values outside the condition with that scalar value, whereas using where() with a callable function allows for more flexibility in applying custom logic to each element of the Series or DataFrame.",https://pandas.pydata.org/docs/user_guide/indexing.html
How can I create a pandas Series from a list of numbers?,"A pandas Series is a one-dimensional labeled array holding data of any type, such as integers, strings, Python objects, etc. You can create a Series by passing a list of values to the `pd.Series()` function. For example: pd.Series([1, 2, 3, 4, 5])",https://pandas.pydata.org/docs/user_guide/10min.html
What is the purpose of the `axis` parameter in pandas DataFrame methods?,"The `axis` parameter determines whether the operation should be performed along the rows (by default) or columns. For example: df['Name'].sum() calculates the sum of values in the 'Name' column, while df.sum(axis=1) calculates the sum of each row.",https://pandas.pydata.org/docs/user_guide/10min.html
How can I create a pandas Series with a default RangeIndex from a list of values?,"You can pass a list of values to the pd.Series constructor, and pandas will create a default RangeIndex. For example: s = pd.Series([1, 3, 5, np.nan, 6, 8]). The result is a Series with a default integer index starting from 0.",https://pandas.pydata.org/docs/user_guide/10min.html
How can I create a pandas DataFrame with labeled columns using date_range() and a NumPy array?,"You can use the pd.date_range function to create a datetime index, and then pass a NumPy array as the data. The result is a DataFrame with the specified column labels: df = pd.DataFrame(np.random.randn(6, 4), index=pd.date_range('20130101', periods=6), columns=list(""ABCD"")). The resulting DataFrame has the date in the index and the column names 'A', 'B', 'C', and 'D'.",https://pandas.pydata.org/docs/user_guide/10min.html
How can I create a pandas DataFrame from a dictionary of objects where the keys are the column labels?,"You can pass a dictionary of objects to the pd.DataFrame constructor, where the keys are the column labels and the values are the column data. For example: df = pd.DataFrame({'A': [1, 2, 3], 'B': ['a', 'b', 'c'], 'C': [True, False, True]}) The resulting DataFrame has the specified column labels and data.",https://pandas.pydata.org/docs/user_guide/10min.html
How does the mask() function handle non-boolean values?,"When applied to a Series, the mask() function treats non-boolean values as False. When applied to a DataFrame, it treats non-boolean values as NaN (Not a Number).",https://pandas.pydata.org/docs/user_guide/indexing.html
How does numpy.where() handle missing values in a Series?,"numpy.where() will propagate NaNs if the condition is False for any value. If the condition is True, it returns the corresponding value from the first argument.",https://pandas.pydata.org/docs/user_guide/indexing.html
What is the purpose of the default parameter in np.select()?,The default parameter specifies a value to return when none of the conditions in the conditions array are met. This allows for a fallback option when multiple conditions need to be considered.,https://pandas.pydata.org/docs/user_guide/indexing.html
Can you use numpy.where() or np.select() with a Series as input?,"Yes, both functions can be used with a Series as input. However, it's generally more efficient and convenient to use the corresponding pandas function, such as df['color'] = df['col2'].eq('Z').map({True: 'green', False: 'red'})",https://pandas.pydata.org/docs/user_guide/indexing.html
How does numpy.where() or np.select() handle multiple conditions?,"Both functions can handle multiple conditions using logical operators (and, or). You can chain conditions together to achieve more complex logic.",https://pandas.pydata.org/docs/user_guide/indexing.html
How does pandas handle column selection when the specified column name does not exist?,"When selecting columns using the query() method, pandas falls back to a named index if the specified column name does not exist. This allows for more flexibility in querying DataFrames with non-standard or custom column names.",https://pandas.pydata.org/docs/user_guide/indexing.html
What is the syntax for using the query() method to select rows based on conditions?,"The query() method uses a string-based syntax, allowing you to specify conditions using boolean expressions and logical operators. For example, '(a < b) & (b < c)' selects rows where column 'a' is less than column 'b', which is also true when column 'b' is less than column 'c'.",https://pandas.pydata.org/docs/user_guide/indexing.html
Can the query() method be used to select columns based on conditions?,"Yes, the query() method can be used to select columns based on conditions. By using the syntax '(column_name < condition)' or other logical operators, you can specify which columns to include in your selection.",https://pandas.pydata.org/docs/user_guide/indexing.html
How can I view only the top or bottom n rows of a DataFrame?,You can use the `head()` and `tail()` methods to view the top and bottom n rows of a DataFrame respectively. For example: In [1]: df.head(3) Out[1]: A B C D 2013-01-01 0.469112 -0.282863 -1.509059 -1.135632 2013-01-02 1.212112 -0.173215 0.119209 -1.044236 2013-01-03 -0.861849 -2.104569 -0.494929 1.071804,https://pandas.pydata.org/docs/user_guide/10min.html
How can I get the index or column names of a DataFrame?,"You can use the `index` and `columns` attributes to get the index or column names of a DataFrame respectively. For example: In [1]: df.index Out[1]: DatetimeIndex(['2013-01-01', '2013-01-02', '2013-01-03', '2013-01-04', '2013-01-05', '2013-01-06'], dtype='datetime64[us]', freq='D') In [2]: df.columns Out[2]: Index(['A', 'B', 'C', 'D'], dtype='str')",https://pandas.pydata.org/docs/user_guide/10min.html
How can I convert a DataFrame to a NumPy array?,"You can use the `to_numpy()` method to convert a DataFrame to a NumPy array. Note that this will return a NumPy array without the index or column labels. For example: In [1]: df.to_numpy() Out[1]: array([[ 0.4691, -0.2829, -1.5091, -1.1356], [ 1.2121, -0.1732, 0.1192, -1.0442], [-0.8618, -2.1046, -0.4949, 1.0718], [ 0.7216, -0.7068, -1.0396, 0.2719], [-0.425 , 0.567 , 0.2762, -1.0874], [-0.6737, 0.1136, -1.4784, 0.525 ]])",https://pandas.pydata.org/docs/user_guide/10min.html
What is the difference between a NumPy array and a pandas DataFrame?,"NumPy arrays have one dtype for the entire array while pandas DataFrames have one dtype per column. This means that a NumPy array can only store data of one type, whereas a pandas DataFrame can store data of different types in each column.",https://pandas.pydata.org/docs/user_guide/10min.html
What happens when I convert a pandas DataFrame to a NumPy array using `to_numpy()`?,"When you call `DataFrame.to_numpy()`, pandas finds the most efficient NumPy dtype to hold all the dtypes in the DataFrame. If the common data type is object, this conversion requires copying the data.",https://pandas.pydata.org/docs/user_guide/10min.html
How can I avoid copying data when converting a large pandas DataFrame to a NumPy array?,"To avoid copying data, ensure that the common data type of your DataFrame is not object. Instead, use `to_numpy(dtype=None)` and let pandas choose the most efficient dtype.",https://pandas.pydata.org/docs/user_guide/10min.html
How can I quickly get an overview of my data's distribution and statistics?,"You can use the `describe()` method to show a quick statistic summary of your data, including count, mean, standard deviation, minimum, 25th percentile, median (50th percentile), 75th percentile, and maximum values.",https://pandas.pydata.org/docs/user_guide/10min.html
How do I transpose my data from rows to columns?,You can use the `T` attribute or the `transpose()` method to transpose your data from rows to columns. For example: df.T or df.transpose(),https://pandas.pydata.org/docs/user_guide/10min.html
What happens when I sort my data by an axis?,"When you use the `sort_index()` method, it sorts your data by the index values along a specified axis (0 for rows, 1 for columns). The result is a new sorted DataFrame. For example: df.sort_index(axis=1, ascending=False)",https://pandas.pydata.org/docs/user_guide/10min.html
How do I sort my data by values?,"When you use the `sort_values()` method, it sorts your data by the values in a specified column or set of columns. The result is a new sorted DataFrame. For example: df.sort_values(by='B')",https://pandas.pydata.org/docs/user_guide/10min.html
What happens when I convert my data to a NumPy array?,"When you use the `to_numpy()` method, it converts your DataFrame to a NumPy array, which can be used for further numerical computations or other purposes. The result is a new NumPy array containing the original data.",https://pandas.pydata.org/docs/user_guide/10min.html
How can I efficiently select a specific value from a large Series in pandas?,"You can use the .at() method to access a single value by its label or integer position. For example, `series.at[0]` will return the first element of the series.",https://pandas.pydata.org/docs/user_guide/10min.html
What is the difference between DataFrame.loc[] and DataFrame.iloc[] when selecting rows and columns?,"DataFrame.loc[] selects rows and columns based on labels, while DataFrame.iloc[] selects rows and columns by integer position. For example, `df.loc[0:2, 'A':'C']` will return a subset of the first three rows with columns A, B, and C.",https://pandas.pydata.org/docs/user_guide/10min.html
How can I select all rows where a specific column has a certain value?,"You can use the loc method with label-based selection, specifying the column label and the desired value. For example: df.loc[:, 'column_name'] == value. This will return a boolean mask that you can use to filter the dataframe.",https://pandas.pydata.org/docs/user_guide/10min.html
What is the difference between using loc and at to select a single row and column?,"The loc method selects an entire row based on a label, while the at method selects a single value at a specific row and column. Using loc with a slice (like 'start:stop') includes both endpoints in the selection, whereas using at will exclude the end point. For example: df.loc['start':'stop', 'column_name'] vs df.at[row_index, column_name]",https://pandas.pydata.org/docs/user_guide/10min.html
How can I get fast access to a scalar value from a dataframe?,"You can use the at method to select a single value at a specific row and column. This is faster than using loc because it doesn't create an intermediate boolean mask. For example: df.at[row_index, column_name]",https://pandas.pydata.org/docs/user_guide/10min.html
How can I select rows from a DataFrame based on integer positions?,"You can use the `iloc` method with integer position locations or slices of integers to select rows. For example, `df.iloc[3]` selects the row at index 3. Integer slices acts similar to NumPy/Python: `df.iloc[3:5, 0:2]` selects rows 3 and 4 and columns 0 and 1.",https://pandas.pydata.org/docs/user_guide/10min.html
How can I select specific columns from a DataFrame?,"You can use the `iloc` method with column indices or slices of integers to select columns. For example, `df.iloc[:, 1:3]` selects columns 1 and 2. This allows you to access specific data in your DataFrame efficiently.",https://pandas.pydata.org/docs/user_guide/10min.html
How can I get a value from a DataFrame at a specific position?,"You can use the `iloc` method with integer positions or slices of integers to select values. For example, `df.iloc[1, 1]` gets the value at row 1 and column 1.",https://pandas.pydata.org/docs/user_guide/10min.html
Can I get fast access to scalar values in a DataFrame?,"Yes, you can use the `iat` attribute to access scalar values directly. This is equivalent to using `iloc` with integer positions or slices of integers. For example, `df.iat[1, 1]` gets the value at row 1 and column 1.",https://pandas.pydata.org/docs/user_guide/10min.html
How can I set values in a pandas DataFrame by index?,"You can use the `at` or `iat` methods to set values at specific indexes. For example, `df.at[0, 'A'] = 1` sets the value of column 'A' at row 0 to 1.",https://pandas.pydata.org/docs/user_guide/10min.html
How do I create a new column in a pandas DataFrame that is aligned with the index?,"You can use the assignment operator (`=`) on a Series object, like `df['F'] = pd.Series([1, 2, 3, 4, 5, 6], index=pd.date_range('20130102', periods=6))`. This creates a new column 'F' with values aligned to the index.",https://pandas.pydata.org/docs/user_guide/10min.html
How can I set values in a pandas DataFrame by label?,"You can use the `at` method to set values at specific labels. For example, `df.at['2013-01-02', 'A'] = 1` sets the value of column 'A' at row labeled '2013-01-02' to 1.",https://pandas.pydata.org/docs/user_guide/10min.html
How do I create a new column in a pandas DataFrame by assigning a NumPy array?,"You can use the `loc` method with a NumPy array, like `df.loc[:, 'D'] = np.array([5] * len(df))`. This creates a new column 'D' with values from the array.",https://pandas.pydata.org/docs/user_guide/10min.html
How can I convert a daily dataset to a 5-minute frequency?,"You can use the resample function with the 'B' (business) or 'M' (minute) frequencies, depending on your desired output. For instance, to convert a daily dataset to a 5-minute frequency, you would do: `data.resample('5T').mean()`. This will return a new dataframe with the original data's values averaged over every 5 minutes.",https://pandas.pydata.org/docs/user_guide/10min.html
What is resampling in pandas and how does it affect my data?,"Resampling in pandas involves changing the frequency of your data. When you resample, pandas creates new indices based on the desired frequency. For example, if you have a daily dataset and you resample to a 5-minute frequency, pandas will create new rows for every 5 minutes in that day. The result is a new dataframe with the same values as the original, but with a different index.",https://pandas.pydata.org/docs/user_guide/10min.html
How can I resample a time series to a specific frequency?,"You can use the resample() function with a specified frequency, such as '5Min' or 'Daily'. This will return a new Series with the same data but at the desired frequency. For example: ts.resample('5Min').sum()",https://pandas.pydata.org/docs/user_guide/10min.html
What does it mean to localize a time series to a specific time zone?,"Localizing a time series to a specific time zone means that the dates and times in the Series are now aware of the corresponding offset from UTC. This can be useful when working with data that has embedded timezone information. For example: ts = pd.Series(np.random.randn(len(rng)), rng); ts_utc = ts.tz_localize('UTC')",https://pandas.pydata.org/docs/user_guide/10min.html
How do I convert a time series to a different time zone?,You can use the tz_convert() function to convert a time series from one time zone to another. For example: ts_utc = ts.tz_localize('UTC'); ts_est = ts_utc.tz_convert('US/Eastern'),https://pandas.pydata.org/docs/user_guide/10min.html
What is the purpose of adding a non-fixed duration (BusinessDay) to a time series?,"Adding a non-fixed duration, such as BusinessDay, to a time series allows you to create a new Series with dates that are spaced by a fixed interval, regardless of the original frequency. For example: rng = pd.date_range('2012-03-06', periods=5, freq='D'); rng + pd.offsets.BusinessDay(5)",https://pandas.pydata.org/docs/user_guide/10min.html
How can I calculate the sum of a time series resampled to a specific frequency?,You can use the sum() function on a Series resampled to a specific frequency. For example: ts.resample('5Min').sum(),https://pandas.pydata.org/docs/user_guide/10min.html
How can I plot a cumulative sum of a pandas Series in Jupyter?,"You can use the `plot()` function to plot all columns. First, calculate the cumulative sum using the `cumsum()` method, then call `plot()` on the resulting Series.",https://pandas.pydata.org/docs/user_guide/10min.html
What is the purpose of the `to_csv()` function when writing data to a csv file?,The `to_csv()` function writes a pandas DataFrame to a csv file. It takes an optional parameter for specifying the delimiter and other formatting options.,https://pandas.pydata.org/docs/user_guide/10min.html
How can I read data from a csv file into a pandas DataFrame?,You can use the `read_csv()` function to read data from a csv file. This function returns a pandas DataFrame containing the data from the csv file.,https://pandas.pydata.org/docs/user_guide/10min.html
What happens when you call `plot()` on a pandas DataFrame with multiple columns?,"When you call `plot()` on a pandas DataFrame with multiple columns, all columns are plotted. You can customize the plot further by adding additional arguments to the `plot()` function.",https://pandas.pydata.org/docs/user_guide/10min.html
How can I write a pandas DataFrame to a Parquet file?,"You can use the `to_parquet()` function, which writes the DataFrame to a Parquet file. The resulting file will be compressed and optimized for storage. For example: pd.DataFrame({'A': [1, 2, 3]}).to_parquet('data.parquet')",https://pandas.pydata.org/docs/user_guide/10min.html
How can I read data from an Excel file using pandas?,"You can use the `read_excel()` function to read data from an Excel file. The function allows you to specify the sheet name and any additional parameters, such as ignoring missing values. For example: pd.read_excel('data.xlsx', 'Sheet1', index_col=None, na_values=['NA'])",https://pandas.pydata.org/docs/user_guide/10min.html
How can I perform a boolean operation on a pandas Series?,"You cannot directly perform a boolean operation on a pandas Series. Instead, use methods like 'any' or 'all', or convert the Series to a boolean DataFrame using '.bool()' and then apply your desired operation.",https://pandas.pydata.org/docs/user_guide/10min.html
What happens when I try to print the contents of a DataFrame that has been converted to a boolean value?,"If you try to print a DataFrame that has been converted to a boolean value, it will display 'True' or 'False' for each row instead of the original data. To retrieve the original data, use '.values' or '.to_frame()'. For example: df = pd.DataFrame({'A': [1, 2, 3]}); bool_df = df.to_bool(); print(bool_df.values)",https://pandas.pydata.org/docs/user_guide/10min.html
How can I create a hierarchical index for my data with labels that reflect both category and subcategory?,"You can use the MultiIndex.from_tuples() method, which allows you to specify multiple tuples representing unique combinations of categories and subcategories. For example: `import pandas as pd; indices = [('A', 'X'), ('A', 'Y'), ('B', 'X')]; multi_index = pd.MultiIndex.from_tuples(indices); print(multi_index) # Output: Index(['A', 'B'], dtype='object')",https://pandas.pydata.org/docs/user_guide/advanced.html
What is the purpose of using a MultiIndex when working with data that has multiple levels of categorization?,"Using a MultiIndex allows you to store and manipulate data with multiple levels of categorization in a structured way. The result is an array of tuples where each tuple represents a unique combination of categories, making it easier to filter, group, or perform other operations on the data.",https://pandas.pydata.org/docs/user_guide/advanced.html
How can I create a hierarchical index for my data?,"A MultiIndex is a data structure that allows you to create a hierarchical index for your data. You can create it from tuples or iterables using the `pd.MultiIndex.from_tuples()` method, or from multiple DataFrames using the `pd.MultiIndex.from_frame()` method.",https://pandas.pydata.org/docs/user_guide/advanced.html
What is the purpose of the `names` parameter when creating a MultiIndex?,"The `names` parameter specifies the names for each level in the hierarchical index. This allows you to label your data and make it easier to understand. For example, if you create a MultiIndex with `pd.MultiIndex.from_tuples([(1, 'a'), (2, 'b')], names=['level1', 'level2'])`, you can access the first level as `index['level1']` and the second level as `index['level2']`.",https://pandas.pydata.org/docs/user_guide/advanced.html
How do I create a MultiIndex from pairs of elements in two iterables?,"You can use the `pd.MultiIndex.from_product()` method to create a MultiIndex from pairs of elements in two iterables. For example, if you have the following iterables: `[['bar', 'baz', 'foo', 'qux'], ['one', 'two']]`, you can create a MultiIndex as follows: `pd.MultiIndex.from_product([['bar', 'baz', 'foo', 'qux'], ['one', 'two']], names=['first', 'second'])`.",https://pandas.pydata.org/docs/user_guide/advanced.html
Can I create a MultiIndex from a DataFrame directly?,"Yes, you can use the `pd.MultiIndex.from_frame()` method to create a MultiIndex from a DataFrame. This method is useful when you already have a DataFrame with multiple columns and want to create a hierarchical index from it.",https://pandas.pydata.org/docs/user_guide/advanced.html
How can I create a hierarchical index in my DataFrame where the first column represents one type of data and the second column another?,"You can use the `MultiIndex` constructor directly. For example, creating a DataFrame with a MultiIndex: `df = pd.DataFrame({'A': [1, 2, 3], 'B': [4, 5, 6]}, index=pd.MultiIndex.from_tuples([('X', 'Y'), ('X', 'Z'), ('X', 'W')], names=['type1', 'type2']))",https://pandas.pydata.org/docs/user_guide/advanced.html
"What is the purpose of using a MultiIndex in a DataFrame, and what are some common use cases for it?",A `MultiIndex` allows you to store data with multiple levels of hierarchy. This can be useful when working with categorical data or when you need to perform grouping operations on multiple columns.,https://pandas.pydata.org/docs/user_guide/advanced.html
How do I select all rows where a specific column value falls within a certain range?,"You can use the .between() method to achieve this. For instance, if you have a DataFrame df with columns 'A' and 'B', you can select all rows where 'A' is between 1 and 3 (inclusive) as follows: df.loc[df['A'].between(1, 3)]",https://pandas.pydata.org/docs/user_guide/advanced.html
